{
  "schema_version": 1,
  "generated_at": "2026-08-26T14:32:07Z",
  "generated_by": "setup-with-claude 0.2.0",
  "platform": "windows",
  "project_root": "C:\\Users\\example\\Coding\\my-project",
  "components": {
    "gstack": {
      "installed": true,
      "scope": "global",
      "install_path": "C:\\Users\\example\\.claude\\skills\\gstack",
      "sentinel": "C:\\Users\\example\\.claude\\skills\\gstack\\SKILL.md",
      "version": "1.60.1.0",
      "notes": "gstack installs globally; a project-local probe would not find it."
    },
    "advanced-planning": {
      "installed": true,
      "scope": "project",
      "install_path": "C:\\Users\\example\\Coding\\my-project\\.claude\\skills\\phase-plan-creator",
      "sentinel": "C:\\Users\\example\\Coding\\my-project\\.claude\\skills\\phase-plan-creator\\SKILL.md",
      "version": "unknown",
      "notes": "A .advanced-plans/ directory alone does not set this to true. Data is not an installation."
    },
    "superpowers": {
      "installed": false,
      "scope": "none",
      "notes": "Considered and not found. Recorded rather than omitted, so a later run can tell 'absent' from 'never looked'."
    },
    "gstack-to-plans": {
      "installed": true,
      "scope": "project",
      "install_path": "C:\\Users\\example\\Coding\\my-project\\.claude\\skills\\gstack-to-plans",
      "sentinel": "C:\\Users\\example\\Coding\\my-project\\.claude\\skills\\gstack-to-plans\\SKILL.md",
      "version": "unknown",
      "notes": "The glue skill shipped by this repository."
    },
    "plannotator": {
      "installed": false,
      "scope": "none",
      "deprecated": "2026-08-26",
      "notes": "Deprecated by this programme. Not installed and not detected. A pre-existing install elsewhere is left untouched."
    }
  }
}
