{
  "schema_version": 1,
  "generated_at": "2026-08-26T14:32:07Z",
  "generated_by": "setup-with-claude 0.2.0",
  "platform": "linux",
  "project_root": "/home/example/coding/my-project",
  "components": {
    "gstack": {
      "installed": true,
      "scope": "global",
      "install_path": "/home/example/.claude/skills/gstack",
      "sentinel": "/home/example/.claude/skills/gstack/SKILL.md",
      "version": "1.60.1.0"
    }
  }
}
